正面 (Word),背面释义 (Definition),例句 (Sentence),词根/助记 (Mnemonic),难度标签 (Tag)
grave,"[/greɪv/]<br>n. 墓穴，坟墓；死亡<br>adj. 重大的；严肃的；黯淡的<br>vt. 雕刻；铭记",The situation is becoming very grave. (局势变得非常严峻。),"grav (重) -> 心情沉重 -> 严肃的/严重的；坟墓是人生沉重的终点。",高考英语词汇
gravity,"[/ˈɡrævəti/]<br>n. 重力，地心引力；严重性；庄严",Newton discovered the law of gravity. (牛顿发现了万有引力定律。),"grav (重) + ity (名词后缀) -> 重力/严重性。",高考英语词汇
great,"[/ɡreɪt/]<br>n. 大师；大人物；伟人们<br>adj. 伟大的，重大的；极好的，好的；主要的",She has shown great courage. (她表现出了巨大的勇气。),基础词汇，无需助记。,高考英语词汇
greatness,"[/ˈɡreɪtnəs/]<br>n. 伟大；巨大",He achieved greatness in his field. (他在自己的领域取得了伟大的成就。),"great (伟大) + ness (名词后缀)。",高考英语词汇
greedy,"[/ˈɡriːdi/]<br>adj. 贪婪的；贪吃的；渴望的",Don't be so greedy. (别那么贪婪。),"greed (贪婪) + y (形容词后缀)。",高考英语词汇
green,"[/ɡriːn/]<br>n. 绿色；青春<br>adj. 绿色的；青春的<br>vt. 使…变绿色<br>vi. 变绿色",We need to adopt greener energy sources. (我们需要采用更环保的能源。),象征“环保”、“新手”或“嫉妒”。,高考英语词汇
greet,"[/ɡriːt/]<br>vt. 欢迎，迎接；致敬，致意；映入眼帘",She greeted me with a smile. (她微笑着向我致意。),"谐音“给热茶” -> 客人来了给热茶 -> 欢迎/致意。",高考英语词汇
greeting,"[/ˈɡriːtɪŋ/]<br>n. 问候，招呼；祝贺<br>v. 致敬，欢迎（greet的现在分词）",He sent specific greetings to his family. (他专门向家人表示了问候。),"greet (问候) + ing (名词后缀)。",高考英语词汇
grey,"[/ɡreɪ/]<br>n. 灰色<br>adj. 灰色的；灰白的<br>vt. 使变成灰色；使变老<br>vi. 变成灰色；老化",The sky was grey and cloudy. (天空灰蒙蒙的，多云。),"颜色词，grey(英式)/gray(美式)。",高考英语词汇
grief,"[/ɡriːf/]<br>n. 悲痛；忧伤；不幸",She was overcome with grief. (她悲痛欲绝。),"grav (重) -> 心情沉重 -> 悲伤。谐音“鬼父” -> 悲剧 -> 悲伤。",高考英语词汇
grocery,"[/ˈɡroʊsəri/]<br>n. 食品杂货店<br>食品杂货",I need to buy some groceries. (我需要去买些杂货。),"grocer (杂货商) + y -> 杂货店。",高考英语词汇
ground,"[/ɡraʊnd/]<br>n. 地面；土地；范围；战场;根据<br>v. 研磨（grind的过去分词）；压迫<br>adj. 土地的；地面上的；磨碎的；磨过的<br>vt. 使接触地面；打基础；使搁浅<br>vi. 着陆；搁浅；依靠","The plane was grounded due to fog. (飞机因雾停飞。)",基础词汇。be grounded (被禁足/停飞)。,高考英语词汇
group,"[/ɡruːp/]<br>n. 组；团体<br>adj. 群的；团体的<br>vt. 把…聚集；把…分组<br>vi. 聚合",We worked in groups of four. (我们四人一组工作。),基础词汇。,高考英语词汇
grow,"[/ɡroʊ/]<br>vt. 使生长；种植；扩展<br>vi. 发展；生长；渐渐变得…","Money doesn't grow on trees. (钱不是大风刮来的/树上长的。)",基础词汇。,高考英语词汇
grown-up,"[/ˈɡroʊn ʌp/]<br>n. 成年人<br>adj. 成熟的；成人的",Act like a grown-up! (表现得像个成年人！),"grown (长大的) + up -> 成年人。",高考英语词汇
growth,"[/ɡroʊθ/]<br>n. 增长；发展；生长；种植",Economic growth has slowed down. (经济增长放缓了。),"grow (生长) + th (名词后缀) -> 增长。",高考英语词汇
guarantee,"[/ˌɡærənˈtiː/]<br>n. 保证；担保；保证人；保证书；抵押品<br>vt. 保证；担保",We guarantee the quality of our products. (我们保证产品质量。),"guard (保卫) -> 担保 -> 保证。谐音“夹软梯” -> 救人要保证安全。",高考英语词汇
guard,"[/ɡɑːrd/]<br>n. 守卫；警戒；护卫队；防护装置<br>vi. 警惕<br>vt. 保卫；监视",The dog guarded the house. (狗看守着房子。),与ward (看护) 同源。,高考英语词汇
guess,"[/ɡes/]<br>n. 猜测；推测<br>vi. 猜；推测；猜中<br>vt. 猜测；推测；猜中；认为",Can you guess how old I am? (你能猜出我多大吗？),基础词汇。,高考英语词汇
guest,"[/ɡest/]<br>n. 客人，宾客；顾客<br>adj. 客人的<br>vt. 款待",Be my guest. (请便/别客气。),"host (主人) 的反义词。",高考英语词汇
guidance,"[/ˈɡaɪdns/]<br>n. 指导，引导；领导",She looked to her parents for guidance. (她向父母寻求指导。),"guide (指导) + ance (名词后缀)。",高考英语词汇
guide,"[/ɡaɪd/]<br>n. 指南；向导；入门书<br>vt. 引导；带领；操纵<br>vi. 担任向导",The stars guided them home. (星星指引他们回家。),"谐音“盖的” -> 盖房子需要指导图纸。",高考英语词汇
guilty,"[/ˈɡɪlti/]<br>adj. 有罪的；内疚的",He felt guilty about lying. (他因撒谎而感到内疚。),"guilt (罪行) + y -> 有罪的/内疚的。",高考英语词汇
guitar,"[/ɡɪˈtɑːr/]<br>n. 吉他，六弦琴<br>vi. 弹吉他",He plays the guitar very well. (他吉他弹得很好。),外来词音译。,高考英语词汇
gulf,"[/ɡʌlf/]<br>n. 海湾；深渊；分歧；漩涡<br>vt. 吞没",The Gulf of Mexico. (墨西哥湾。),"谐音“高夫” -> 高尔夫球打进海湾。",高考英语词汇
gum,"[/ɡʌm/]<br>n. 口香糖；树胶；牙龈<br>vt. 用胶粘，涂以树胶；使…有粘性<br>vi. 发粘",Chewing gum is not allowed in class. (课上不许嚼口香糖。),"谐音“干” -> 树干流出的胶 -> 树胶/口香糖。",高考英语词汇
gun,"[/ɡʌn/]<br>n. 枪支；枪状物；[美俚] 某种用具<br>vi. 用枪射击<br>vt. 向…开枪",He pointed a gun at the target. (他用枪指着目标。),基础词汇。,高考英语词汇
guy,"[/ɡaɪ/]<br>n. 男人，家伙；（Guy）盖伊（人名）<br>vt. 嘲弄，取笑<br>vi. 逃跑",He is a nice guy. (他是个好人。),口语词。,高考英语词汇
gymnasium,"[/dʒɪmˈneɪziəm/]<br>n. 体育馆；健身房",The school has a new gymnasium. (学校有一个新体育馆。),"gym (体育馆) 的全称。源自希腊语 gymnós (裸体的)。",高考英语词汇
habit,"[/ˈhæbɪt/]<br>n. 习惯，习性；嗜好<br>vt. 使穿衣",Old habits die hard. (旧习难改。),"have (拥有) -> 拥有的行为模式 -> 习惯。",高考英语词汇